Rating,Comments
5,"I am a little over a week using this program and I am enjoying it so far. My only problem is trying to add my water consumption every time, for some reason I does like the way it is setup. But the app is great."
5,"This app is the best, it keeps track of how long you've fasted, how much steps you've taken and how much water you drink. I haven't been able to find a better app 10/10 recommend."
5,"Great app to keep track of IF. I have been using the app for more than a month now, i have the pro version. Lost 7kg in 30 days, great insights and tips to support your IF. Recommend this for anyone planning to start IF. Thx developer"
5,"Brilliant. Helping me stay motivated and helping keep the fasts enjoyable. Yearly membership is a steal. Thank-you. P.s, only slight gripe is I can't transfer membership to my ios device from android. But this app still thoroughly deserves 5 stars."
5,Excellent APP. Helps keep you focused. Count down feature showing how long you have fasted Lots of different options available
5,This app has been really helpful as part of my weight loss programme. It's so easy to use and really motivational.
5,"Good non-invasive app. Gives info and orientation for intermitent fasting. But, ultimately, is up to you."
5,It has been a great start. The app is fantastic for beginners. It keeps me on track. Superb free app. A must have for beginners. Great job guys!
5,Love it! Simple and easy to use. I especially appreciate the info on what my body is going through at each phase of the fasting state. Very informative.
5,"Lots of info, helps push you to hit your goals, and it helped me reduce portion sizes, too. Great app!"
5,"Excellent app for tracking weight loss, fasting periods and water intake. Using in conjunction with the Fast 800 Keto diet gives a good base of recipes too. Lost 7lbs in 7 days so something is working!"
5,Really good no complaints at all it does not push buying premium and it lets you do your own thing sometimes it gets annoying on other apps cuz they try to push everything at one time this app just like take it slow take and easy I love it so much
5,Really detailed dashboard and the infomation about what's happening during the fast is great. I also love the big timer.
5,Please add the OMAD 23/1 that will Make this App the best fasting tracker ever. I have used both Zero and Life IF apps and this is just as good if not better. The interface is good.
5,"Really great app, real-time fasting timer and tips are really good. Only been using it for for a week and lost 4lbs already."
5,"Actually valuable helpful hints, decent layout, smooth operation, motivational effect. 0 complaints - nice job."
5,This is the best fasting app ever. Has levels of fasting and what is happening each hour of your fast. It even has a weight tracker.
5,Really amazing do fat i have gone 4 days do this and this app is amazing. I wish i could get preuim but i cant.I am not able to get preuim due to not have a credit card on google play and i cant use my parents credit cards
5,Honestly its a great app it helps you throughput the day but it would help more if I put more effort in i sometimes cheat on the diet 🙊😳😅but its all good becayse this app helps you get back on track
5,This app helps in every aspects to improve health get a good physical appearence and everything. And because of that i gave it 5 stars because they deserve it.
5,"This is my first time fasting, in the beginning I did for 10 hours instead of the 14 hours, my blood sugar was getting low because I was sweaty and feeling light headed. It was time to eat."
5,It is awesome..Highly recommend this app...suberb...but please make it like 1 or 2 week challenge to lose 1or2 kg of weight it will be more good for me..so it wan't take much time for weight loss...
5,"It's a very good app! It was easy to use but, it would be best if their is an alarm as a reminder. But overall it's a pretty decent app!!"
5,"I love the app very much,it is very easy to follow,I love all the tips and tricks to stay focus in your plan."
5,As a first timer this app has really helped me keep track of my fasting and keeps me motivated with each passing hour. Great app!
5,"This app is helpful to track my progress and it will remind me to drink water throughout, which is great. Thanks"
5,Not had it for long but purchased the year. App seems stable and its encouraging to stick to the fast.
5,Excellent program. Using it daily without any complications. Very intuitive.
5,I really like this app. It helps me to regulate when I eat and what I eat. I just think this app is very convenient and I love it so this deserves a 5 stars to me.
5,Very good app easy to use and understand
5,Best app for intermittent fastimg their efforts for people is highly appreciated. They give this app with almost no ads.
5,Just switched over from another fasting app. So far so good. After I've used this for awhile I'll update my review and compare it to the app I was using - Fastic.
5,Beat tning 3ve ribs help me lose several pounds and is really easy to use
5,This have worked for me. I have lost 5lbs already and been doing this for only 2 weeks. I love being able to track all my info. I fast for 10-11 hours a day.
5,"Great app, helped me well in keeping track of my fasting. Would recommend it to those that fast. Great for beginners too."
5,Super easy & efficient app for fasting. Highly recommended for beginners or pros.
5,Super easy to use and keep track... Really handly to have along side to help
5,"Assalamu alaikum wr wb!!!! Iam soooo happy to use this app this, everything is perfect,no worries,and Insha Allah you'll lose wait very sooner!!! ALL THE BEST!!!!"
5,Really good app for beginers and experienced people who like to fast. Easy to use and very usefull.
5,"The best app ever, i would recommend."
5,I love this app! So easy to use and understand. I would like to access more insights though without paying.
5,Really good app for fasting l. Highly recommended 👌
5,Effective cheap option for fasting
5,I mean it helped me lose atleast 5 kg in 3 months and now I am on my way to lose 3 kg more... It works for me
5,Knowing what is going on in your body while taking helps for with the hunger feelings. My go to app when I need to lose a few pounds.
5,This app have been I live saver thank you so much for creating it it's extremely motivating not boring at all easy to work with easy to understand
5,Perfect to track your fasting periods...keeps track and keeps you motivated to want to fast more and more
5,"New to fasting, first day I had an headache, just have to keep going, great if you want to lose weight."
5,Been fasting for years...use this app only for longer fasts now. No complaints. Free and still effective. Good.
5,Best app for fasting. Guides you and offers informs you. This is the app to use for beginners and helps you understand.
5,I've been fasting for 5 Weeks now and lost 2.3Kg! Easiest way to lose weight! Nothing works for me but this works! Thanks the app!
5,Really easy to work. You can edit it! Love that part because I does always remember to stop it. It's just really good.
5,This App helps me stay motivated. The added on bonus of reminding me to drink water is great!!
5,I'm pretty experienced fasting..sometimes I lose track of time but those app keeps me on point..kudos
5,This app made it easier to fast. But intermittent fasting doesn't work for me.
5,Been using it for years and still love it. Simple and straightforward.
5,Very helpful app and great tips for beginners.
5,This app in very helpful keeping me on track fasting I look forward to checking it everyday!
5,A helpful app for sure. Reminds you to drink water and give you very nice suggestions!
5,It's a good fasting app that has lots of info for those who are starting out fasting.
5,Great app just wish they had a widget! But awesome app easy to use tells you whats going on helps keep myself accountableb
5,I like that you can easily start and stop the fast timer and it keeps track of how long you ate and fast
5,You are the best app that I have ever installed . It really helps me for losing weight. Thank you . You are perfect .🦋
5,I love this app.Its easy to use and it has a plan for your weight loss journey
5,The app is easy to use and it makes tracking one's progress very easy
5,Such a big help on tracking my Intermittent fasting journey to healthy life!!thank u for this app!!
5,App helps me to see where I am in the levels of fasting and charting progress is motivating
5,Thanks for getting me back into shape and it's worth your time Thanks again for all your hard work and hopefully it'll pay off in time in the next generations to continue to lose weight and stay fit for lifetime cause you may not always want stress in the work areas where others being hurt for no reasons for it at all so lose weight and stay away from workplaces that will stresses you out
5,It's a best option if it's hard for you to diet or go according to your plan. I recommend this. You'll even enjoy it!
5,It's a good app. I does really have much to say but the adds are kinda a problem
1,stupid app
1,Bad
1,Worst
2,Way too many adds. It's a nice app but if I have to wait 40 seconds and watch an add to see where I'm at in my fast - not worth it.
2,"There are way too many ads. You can't even get into the app without having to watch a whole ad. If you somehow ignore the ads, though, it's a fair app, easy to use and understand, and the fasting achievements makes it more fun."
2,It was a terrible app up until a few days ago. Now it's nothing but a bunch of pop up advertisements. Will be deleting this app after I finish my fast. Disappointed
2,"terrible App, but enough with all the ads! After Every action is an Ad, just plain greed. Very frustrating."
2,terrible app but I'm trying to cancel my subscription and I'm still getting charged!! I can't find end subscription option in settings please help
2,"I had to delete the app. After a year or so, I had to endure far too many ads just to track my progress. By the time it loaded, I forgot what I was attempting to do! The problem worse as time went on. Now, I'm searching for a new app."
2,This don't give me any update or notifications when to start or stop eating when I close the app. Therefore it's not really useful
2,"Used to be bad until now. I have to endure a full minute of advertisement to open the app. Now it is uninstalled, thank you very much."
2,"Ads are excessive, and things it advertises, like the body status are no where to be found."
2,"Had to remove a few stars. Can't get past the ad to get into the fasting app. It's in another language. I have everything set to English, not sure what's going on. Since I can't use the app, it goes from 5 stars down to 2."
1,"Ads are too frequent and too long. The photo ads that appear each time you open the app are acceptable, but those video ads where you have to wait five seconds to close them are a true test of patience."
1,can't get in too many ads that won't go away and if I close the app and open again.... another ad pops up
1,"Re: in-ter-mit-tent, adj., occurring at irregular intervals; not continuous or steady."
1,Add pop out every time I open it and try to log. Waiting time to close the app is even longer than the time I log my data. I ended up spending lots of time waiting to close the ads every day. It's very time consuming and annoying.
1,Incredibly long to boot up and lots of long ads just to pull up fasting timer.
1,"Using it for 55 days ,off last week it started paidzing, I uninstalled and reinstalled it lost all data despite it syncing,shows no badges, no awards this is frustrating."
1,"If you want a simple way to track a fasting option, this one will nickel and dime you. Tracking 1 meal a day fasting is a paid option, which is absurd."
1,"Nah fam. With the newest update, I can't set my own eating period unless I go paid. Rather, you purposefully made it more cumbersome to do so as I would need to change it every day? 5 star to 1 star, just like that. I'm uninstalling and finding a better app."
1,"It's ok to have ads, it's not ok to have LONG ads. More than 30 sec ad just to click a button? What happened to this app...."
1,"WAY too long to open due to having to watch ads 1st....had it for a long time, switching to something else."
1,"Even though I bought no ads months ago, they have put ads in every part of this app. It's complete trash now and unusable."
1,I just paid for premium and still get ads and asking to sign up from premium. I am about to reverse some charges on a card.
1,It used to be bad now its not informative and full of ads.
1,"The ads contains sexual content, I wrote multiple feedbacks no solution. Uninstalling"
1,We all put up with adverts to try apps out but this one does not allow you to remove the advert after having read and acknowledged it.
1,"Cannot select 17:7, also bombarded with pop-ups to upgrade. No, thank you."
1,I dont think this is accurate because when u r fasting you cant drink water and this app says that water does not break your fast this absolutly wrong because when you are fasting you are not allowed to drink or eat.it is bad for normal days but its not bad for ramadan.
1,It's been terrible... I jxt can't lose wait on my own buh with dis fasting app... I feel bad cos it's lyk a companion Dat guides me with weight loss
1,I fell like this shouldn't be an app because of how easily someone can develop an ED from this. So I don't think the app should be rated for everyone.
1,Too many nonsense ads. Don't waste your time.
1,Way too many advertisement and lagged out and stopped tracking
1,"Couldn't restore premium account, after i switched from ios to android"
1,A lot is behind monthly pay wall.
1,You guys should have never made this it is not ok to tell people to fast my 23 year old daughter tried it and she ended up in hospital in the ICU center so any one who is doing this please don't this is life threatening if I could give this 0 stars oh don't sought me I would
1,Worst app ever ssly its so bad it tells me to leave one meal like ssly
1,I don't have money for get premium
1,I don't have money for get premium
1,Be careful or you will be charged large sums of money
1,Why? I can't restore my progress
1,I don't like it.
1,No notification
1,Why can't the sound be turned off for ads?! I've looked in settings and can't figure it out. Never had an app like this just open with sound blasting and no option to mute. Definitely not using this anymore if that's the case...
1,Poorly explained or non-existent instructions. Functionality inadequate. Pointless app. It's easier just to set alarns on your phone to remind you when to start/stop fasting.
1,It's a player of unclosable advertisements. Very frustrating when you have to force close an app due to persistent ads. The X button does not function and is for decoration only.
1,I paid for a monthly subscription and was bumped off of it after 2 weeks. The app goes back into suggesting I go premium. Google still shows that I am still subscribed. Not sure if this is an error or if this is robbery.
1,Update. It's still awful! The time edit feature is so clumsy to use and the design doesn't allow simple typed input of the time. I'm now looking for a better fasting tracker. Plenty around.
1,"Too much adds :( close button do nothing, I press it but nothing happens, so I need to close app and reopen it to be able to use. App is basically just a timer but the splash screen loading time is insainly slow."
1,"Purchase is too much money. paid version was ok at first, then ads start popping up and have to wait for ad to finsh before using app. Deleted. Using stopwatch built into smartphone. Works as well."
2,"it's glitchy after recent update. When you end your fast, you cannot adjust the time back if tou need to. It does not give you a ""today"" selection, which ruins your data and your stats. This didn't used to happen. I hope it's fixed soon or I'll have to find a different tracker app."
2,"The app looks bad and works well, but the ads are too numerous and too intrusive. Especially the video ones when you open the app. They aren't skipable, and they seem to cause a delay opening the app (maybe while they load)?"
2,"The ads are way too intrusive. I don't mind ads, that's how you get paid I get it, but when I'm in a hurry and trying to open the app and an ad plays right off the bat, I'm finding another solution"
2,"So obnoxious. I just needed a simple fasting tracker (I've been intermittent fasting for years). Instead, I got a busy UI, too many popups, and annoying questionnaire filled with obnoxious messages I don't need. Two stars for not selling my data."
2,A lot of the options are locked behind a paywall. OMAD is also locked behind a Paywall. They give the option for custom but you can only set a start and have to manually stop the fast. I will be look at other options.
2,"It's a decent app if you pay for the subscription. Feels like it's made for kids, though, as every day you finish you get a million ""badges"". I just wanted a simple fasting timer."
2,"Money hungry app. Way too many ads, and takes forever to open. Note for the owners, do you really need to have ads when you have so many subscribers. Make the UI experience the best and see what will happen."
1,"Th y did not interact with me. But quietly took my money behind the scenes. I have no order. I downloaded the ""paid"" app"
1,Used to be very bad before introducing overly invasive and unreasonably frequent advertisements.
1,"Everytime I jumped to a different screen, an ad popped up. This was irritating and difficult to negotiate thru the app. I understand that this is a way for revenue but I spent more time closing windows than on the app. Sheesh. Going back to Fastic."
1,"So far so good. I like the app, not so crazy about the ads. **UPDATE- Had to delete app, I can't sit through a 30 sec ad to just log in, that's bananas. Who wants to watch an ad before they can even get onto app to log info 🤦‍♀️"
1,Pretty basic app unless you want to pay $$$ and of course theres ads which are annoying. We always love having a skip the dish ad pop up in the last couple of hours of fasting. Not.
1,"Nice app in terms of the information it provides however, the paid version is full of unskippable ads every time you switch screens. Had to uninstall as I'm not interested in paying for a subscription service to remove the ads. Wish they offered a regular purchase option."
1,"This app is completely unusable if you don't pay. The advertising is extremely intrusive, you can't close out of it, the ads cover the whole screen and won't let you close you of them for a good bit. It's much too annoying, I'm giving up after a day."
1,I tried turning on the notification and the phone non stop vibrating. Overall the app is easy to use! I tried to uninstall and install back the app. All my data lost! My trackings for a month lost! I paid the premium and i have to start over again
1,Not usable on Pixel 6. It is not possible to skip or close any of the ads. Even when they've played the close button does not work. I have to close the whole app and reopen it every time an ad is played.
1,This is really freaking hard to figure out how to work. I'm constantly just going around poking things stop how to stop the feeding program. I can't even change the times if it's minutes plus or minus without it starting the whole what do you want your program to be again.
1,"Takes very long to open, not usable if you just want to track your fasting. For setup, I gave my last and first meal and they gave me exactly the time between the two for fasting. Most buttons which promise info just lead to the pay version. Useless app..."
1,"I uninstalled this because of the new ""full page"" style of ads, just like the word and picture game apps, not because of the fasting content. Now the app still shows up on my update list. Hopefully it will go away. I do not appreciate having to complain."
1,"I am a paying customer, it is not worth the price. That being said, a paid use would not have any issues with the app. I tried custom plans, twice, and each time my progress was removed at the end of the week, I contacted support but no response. Get another app."
3,"Love this app overall, but I feel it can use some improvments like account syncing. I would love if the app synced across all my devices so I can keep track of my status."
3,i really wanted to get fit so i downloaded some apps this was one of the i have only had it for 3 days and it was my first time fasting. I forgot what i was doing so i started to eat. i rememberd after i ate i was suposed to be fasting. so i clicked stop fasting and put when i stopped eating i went back and it didnt stop it i tried to put it in a few nore times it dosent work.
3,Starting in times keep changing and Icon for app disappears after one day
3,"I installed the app on 2 devices (phone & tablet). I paid for the yearly subscription and enabled Google Fit integration. But the 2 devices are out of sync! I had to enter my details and select a fasting schedule twice! And even though I set and have been following a daily schedule, it shows me that I have been fasting for over 2 days, as if it's expecting me to manually log the fasting start/end times each day!? 🤦🏻‍♂️"
3,"I've been testing this app for more weeks, and I like it. Is there an option to MANUALLY IMPORT or migrate fasting data from another app (LIFE Fasting, for example) or MANUALLY ADD the entries FOR MORE THAN THE LAST 10 DAYS? If this is impossible, then I will have to stick with the same apps that I've been using until now, because I really care about ALL MY FASTING HISTORY. (Your answer suggests that you didn't read the last part of my message. I've edited my review so you can see what I mean.)"
3,"Functional app, but way too many ads, and they're long ads. I could upgrade, but would have liked to try it out longer to see if I like it."
3,I don't get it. Why an app? Been doing IF for 13 months so far. While searching something else I saw and installed this app. Tons of info included. A bit of overwhelm. Simple solution skip one meal a day to limit eating during any eight hour window of your choosing. Mine is noon till 8p.m. No app needed. And no excuses preventing fasting. 'Oh I forgot to set a reminder today guess I'll fast tomorrow.'
3,"The ui is not very good but the constant information I love it. I can't do 24hr fasting in the app, it will not allow me I don't like it. If the app had one life time buy option for like 30$ I would buy it. You have a good app that can be awesome just needs some work."
3,A one time fee to get rid of ads would be sufficient. A monthly fee for information that can be found on the web for free or maybe an eBook just isn't it and kind of a insult to intelligence.
3,"The app is good, the weak point is the monotonous meal plan, that cannot be adjusted"
3,I eat at about 8 p.m. in the evening and then I don't eat until noon one the next day and I keep my meals small but I treat myself a little bit once in awhile I'm quite handicapped so I don't move an awful lot but I do believe in fasting and Dr.Oz also has spoken on this subject
3,Whenever I use the app it immediately drains all my battery out... Leap fitness group pls try to fix it
3,Too many/frequent Ads 🤭
3,Good but please add vegetarian option.
3,"They are good they are great but when they are not, they really sucks."
3,"I fast 24hrs once a week. No support for that in here. Also, sources for your health claims would be more persuasive"
3,I bin fasting sins I was 8 it's my familie's tradition to fast wen your pretty big so for dose who's are doing dis for the first time believe me wen I say at first its gonna by hard but the more you do it you can see it's not dat hard so don't quit please take my word for it 👌
3,Custom area ... won't let me change anything. I want to do 40 hours
3,Nice app
3,"The free app is ok, not too many ads and short. Does a good job reminding you to get water, recording times, weight. But many other apps do the same. Hence, the three stars."
3,"Just completed my first day of fasting, doing the 16/8. It notified me that I made it, I click on it, it asked me when my last meal was(yesterday at 7pm) and it says it has not been long enough to be considered fasting. It's been 16 hours. -.- But now according to the app I have never completed a fast. Edit: when it's asking you to note last meal, it's under the assumption you already ate to start the eating on the next day wish it was clearer on what it's asking for. Avoid confusion for people"
3,Been using this app for a few months and just decided pay for the no ads version today. It's good. My only issue is that the data did not pull over from my old phone. Is there a way to set up an acct or transfer data? Please reach out to me as I can see my progress history now. 😢 🙏 At the moment taking stars off for that.
3,"A little too detailed and a little too invasive for my comfort. There appears to be no way to control personal data once you have it. I could see some folks liking the heavy coaching, but I do not like it."
3,It reminds me to hydrate. Keeps track of my fasting time. I like the app. It is doing exactly what I would expect it to do. Only a few plans available though unless you upgrade to premium.
3,"I'm not getting any notification reminders besides the initial start time one. Then say 62 hours has gone by, I'd have to open the app before it asks ""are you still fasting?"" As in...""have you been fasting a full 62 hours? Go you!"" Like, no, I haven't been fasting for 62 hours straight. Some kind of reminder to ask when the fasting plan you're on has ended just for the day.. would be good to stay on track."
