Rating,Comments
5,"I've been using this intermittent fasting app for a while now, and I gotta say, I'm impressed! It's super modern and user-friendly. Plus, it's packed with tons of useful info that's been a game-changer for my fasting routine. Highly recommend!"
5,"Very good app for intermittent fasting support and control. In free mode there are adds but not too annoying. Plenty of information, graphs and useful recommendations."
5,I does use most of the features in this app. It's easy to update the start and end times of the fast. The one thing I wish it had was a pause or vacation feature as I won't be fasting on vacation and I does really want the notifications.
5,Overall it's a good app. However I do wish there were alternative time lines for fasting. I does usually eat until 1 pm sometimes 2 p.m. so I wish there was a 1-9 fasting option. Good thing is I can manually change my fasting time! I like the app alot
5,"Love that you can personalise your fasting planner. Start and stop fasting, record weight and the rewards do boost you to keep going. I like this app a lot. When i can see it running in the background as im doing my normal day to day, it pushes me to stick at it."
5,"The app is basically the Best, it has kept me disciplined and motivated The Most important features are freely available I love that it shows the count down till end of the fast on the notification panel and shows which level u are at in terms of fat burning and explains it simply, I highly recommend 🔥👍❤️"
5,"This app was working perfectly for a good 2 months. Then the ads popped up on my subscription. If you've had a business and personal email registered under Google for the past 10 years, the fasting app will not register your primary email to which you subscribed thus making it awkward and inconvenient to deregister your business email in order to make the app work ad free. The app refused to acknowledge their fault even after explaining that it worked perfectly for 2 months without ads."
5,"very simple to use. my only critique is that the ads open at the start, so sometimes when I want to end my fast, I have to wait for the ad to finish before I could stop the clock."
5,"Very simple and easy to use app. Also the ""always showing notification"" very helpful for quick info about today fast. I switched to premium after using it in a week. Please add more achievements badge and make it shareable to social media like instagram stickers or something similar. Adding exercise insight will be helpful too. Overall it's a great app."
5,It's a great app to fast with as long as you have the attention span to check your phone for reminders. I really enjoyed the teaching material that it provides on fasting.
5,My favorite thing about this app is that it tells you what is happening with your body based on the amount of hours you have fasted. Planning to get the paid version soon. I used it alongside 2 others for comparison and this is my favorite.
5,This has been a great app so far. It's very interesting going through the different stages of fasting and having an idea of what's going on with the updates from the app in time intervals.
5,"Nice and simple app, giving the fasting/eating time and reminder to drink water. I find it very useful and it helps me to keep with intermittent fasting"
5,I've used this App off and on for intermittent fasting. I've tried others but I keep coming back to this one. This time I went ahead and upgraded to the paid version to open more options. We'll see how that goes.
5,"This is the best fasting app , i,m currently 12 years old and i,ve been fasting for 48 hours ,and i can feel myself being more happy and i,m also able to concentrate better in class. And i like how the app has a water drinking tracker. But i have a question , how long will it take for me to lose about 15 pounds?"
5,Very user friendly and it's handy to keep tabs on your progress whenever you feel the need. Packed with useful tips to help you maximise your IF experience
5,I like the design of the app and it's features (very aesthetic). It's easy to use and understand (which is great for me). I also love that I can use the basic features of the app for free. <3
5,"Doing an amazing job! When I get my check will definitely upgrade to premium! This app does everything I need to track my progress and to keep me motivated to continue! I love the little milestone achievements it gives you as well, because it Is really nice to see some recognition for hard work. Absolutely appreciate this app and they have more than earned a lifetime customer with me. I would add if I could choose anything... a social area for fellow dieters to have further support. 10 stars!"
5,This is the most simple to understand no nonsense fasting app I've tried. I also really enjoy the hourly updates telling me what is happening in my body at different stages of the fast. That feels motivating to me.
5,"Good so far! Easy to use and lots of features- I'm seriously considering buying the year plan, which is pretty reasonable. Definitely recommend to anyone interested in fasting from beginners to experienced fasters. I think this app will be helpful to everyone."
5,"This is the most amazing app for intermittent fasting available, easy to use, complete progress charts , I loose 10.6 pounds so far with the guidance of this app, free to use without paying with a premium paid version that I'm considering to join, because this app is not just to loose weight but a healthy lifestyle . I tried all the others' apps until I found this one , highly recommended 👌 the best so far and user-friendly. Thank you 😊 💓"
5,"So far so good! I've only been doing this for a week now, and it's been going pretty good. Better than counting calories or carbs. It's also easy to forgive. At this time I'm habit building. There's lots of good tips, challenges for those that need to be challenged, and a water intake monitor. I've been drinking loads more water which is healthier over all. Worth a try I think, especially if you hate counting."
5,"Well It's very comfortable guys you need to try it now and results would me as expected if you are committed to it and this app is easy to understand, features are really great and tips are wow"
5,"My only wishlist item would be a social feature. It's great flying solo, but sharing fasting adventures and tips with a community could be the missing spice. Overall, it's a solid app for anyone diving into intermittent fasting without making it feel like you're on a tech rollercoaster. Thumbs up from me!"
5,"Great app, I use it daily, paid for premium. Excellent for tracking fasted times. However the only thing I can ask for is a 'Body Fat Percentage' in the weight category, so that can be used as the tracker/goal. I does use KG for tracking my progress as that fluctuates too much, but body fat is more accurate"
1,"Gave up trying to line up the time. I could not for the life of me get the app synced up to my schedule. Then, the extra kicker is that every time I made an adjustment, I would need to watch an ad. I made 5 consecutive changes and watched an ad between each change. Truly obnoxious."
1,"Way too aggressive with the ads. And come on with the monthly charge for a mobile fasting app. Everyone is so greedy. Just charge a reasonable rate for app, you dont have to follow the trend of monthly plans."
1,"It does whatever it wants to do apparently. I eat between 4 pm-12am sometimes I eat later ,sometimes I eat earlier.last night I started fasting at 9pm but I just woke up at 4:53pm well the app decided to automatically start my eating period while I was asleep AGAIN. Which it's not supposed to do its supposed to overlap the time like it's always done.this is y I dont fw technology like that anymore bcz strange stuff happens."
1,An incredible amount of ads permiate the paid version of this app. A full page video ad shilling crypto now appears when I open or close any page in the app. Is 4.9 stars the time to start doing this? I wouldn't think so.
1,Why am I being charged again?? I paid $2.99 for the month. I wanted to switch type of fast so I ended week I was on early. Now app has locks on everything again. I just paid last week!! Help please
1,"This is not real fasting, this is about getting hungry. Real fasting it means to eat non greasy food just healthy like fruits and vegetables, drink a lot of water, eat raw food not cooked. For instance I am fasting every Friday, that means that day I eat only fruits and vegetables, no meat, noo milk products, no eggs, and it is enough to get control over what you choose to eat, and it raises your awareness over eating, as the feeling after fasting day is terrible you strive for healthier food after"
1,"I bought a yearly premium plan, and after 3 months, I start seeing ads and my account become non premium again. This is a scam!"
1,"Horrible,never download this app ever as soon as you get in the app it just closes,and as soon as I got in for the first time it was a nightmare,it was lagging so much,it was creepy,it said that someone was watching you,never download this app ever"
1,We all put up with adverts to try apps out but this one does not allow you to remove the advert after having read and acknowledged it.
1,"Cannot select 17:7, also bombarded with pop-ups to upgrade. No, thank you."
1,I dont think this is accurate because when u r fasting you cant drink water and this app says that water does not break your fast this absolutly wrong because when you are fasting you are not allowed to drink or eat.it is bad for normal days but its not bad for ramadan.
1,It's been terrible... I jxt can't lose wait on my own buh with dis fasting app... I feel bad cos it's lyk a companion Dat guides me with weight loss
1,I fell like this shouldn't be an app because of how easily someone can develop an ED from this. So I don't think the app should be rated for everyone.
1,Too many nonsense ads. Don't waste your time.
1,Way too many advertisement and lagged out and stopped tracking
1,"Couldn't restore premium account, after i switched from ios to android"
1,A lot is behind monthly pay wall.
1,You guys should have never made this it is not ok to tell people to fast my 23 year old daughter tried it and she ended up in hospital in the ICU center so any one who is doing this please don't this is life threatening if I could give this 0 stars oh don't sought me I would
1,Worst app ever ssly its so bad it tells me to leave one meal like ssly
1,I don't have money for get premium
1,I don't have money for get premium
1,Be careful or you will be charged large sums of money
1,Why? I can't restore my progress
1,I don't like it.
1,No notification
1,Fasting
1,Gud❤
1,Cool 😎 😂😂😂😂
1,stupid app
1,Bad
1,Worst
2,"App is ok. it's a little bit bloated with useless clatter. Also, there is no option for no weight loss. It forces you to pick up some goals, and there is no way around. The widget of this app is a complete waste of time, had no use, no sense, and it is bizarre. Shame. I wouldn't advice to pay for the premium version."
2,"Paid for the premium version. Still got ads. Bought the premium version for the autophagy fasts but there's only a 36 and 48 hrs plus you have to wait for 55 hr eating window before it will start. Theres no way to start an autophagy fast immediately. The custom plan feature doesn't work. I read in another post that the ""custom plan"" feature will be coming later. Why have the feature? This is just a pretty timer that has a few notifications that has very little customization. Dont bother"
2,Terrible UX. Ending fasting and starting a plan again gets frustrating if you use the paid version. Ads are huge and in your face and pop up between selections. Kinda suspect this is the highest rated fasting app...
2,"Just some (paid on google) interesting advice. The tracker is Useless junk. don't waste your money. NOTE..The developer responded with a suggestion that after spending $20., I should spend more on the Premium product ..... FAT chance....."
2,I don't see anywhere that I can track my food on this app. Makes it kind of useless.
2,Cannot adjust my fasting time when I fast longer than my selection.
2,"It all sounds right, but can I do it? I think I can!😆"
2,Ni information and of guides if you don't buy
2,The same few recipes options!
2,Pogisigena
2,mong app có phần dịch tiếng Việt
2,I don't see anywhere that I can track my food on this app. Makes it kind of useless.
3,"I installed the app on 2 devices (phone & tablet). I paid for the yearly subscription and enabled Google Fit integration. But the 2 devices are out of sync! I had to enter my details and select a fasting schedule twice! And even though I set and have been following a daily schedule, it shows me that I have been fasting for over 2 days, as if it's expecting me to manually log the fasting start/end times each day!? 🤦🏻‍♂️"
3,"I've been testing this app for more weeks, and I like it. Is there an option to MANUALLY IMPORT or migrate fasting data from another app (LIFE Fasting, for example) or MANUALLY ADD the entries FOR MORE THAN THE LAST 10 DAYS? If this is impossible, then I will have to stick with the same apps that I've been using until now, because I really care about ALL MY FASTING HISTORY. (Your answer suggests that you didn't read the last part of my message. I've edited my review so you can see what I mean.)"
3,"Functional app, but way too many ads, and they're long ads. I could upgrade, but would have liked to try it out longer to see if I like it."
3,I don't get it. Why an app? Been doing IF for 13 months so far. While searching something else I saw and installed this app. Tons of info included. A bit of overwhelm. Simple solution skip one meal a day to limit eating during any eight hour window of your choosing. Mine is noon till 8p.m. No app needed. And no excuses preventing fasting. 'Oh I forgot to set a reminder today guess I'll fast tomorrow.'
3,"The ui is not very good but the constant information I love it. I can't do 24hr fasting in the app, it will not allow me I don't like it. If the app had one life time buy option for like 30$ I would buy it. You have a good app that can be awesome just needs some work."
3,A one time fee to get rid of ads would be sufficient. A monthly fee for information that can be found on the web for free or maybe an eBook just isn't it and kind of a insult to intelligence.
3,"The app is good, the weak point is the monotonous meal plan, that cannot be adjusted"
3,I eat at about 8 p.m. in the evening and then I don't eat until noon one the next day and I keep my meals small but I treat myself a little bit once in awhile I'm quite handicapped so I don't move an awful lot but I do believe in fasting and Dr.Oz also has spoken on this subject
3,Whenever I use the app it immediately drains all my battery out... Leap fitness group pls try to fix it
3,Too many/frequent Ads 🤭
3,Good but please add vegetarian option.
3,"They are good they are great but when they are not, they really sucks."
3,"I fast 24hrs once a week. No support for that in here. Also, sources for your health claims would be more persuasive"
3,I bin fasting sins I was 8 it's my familie's tradition to fast wen your pretty big so for dose who's are doing dis for the first time believe me wen I say at first its gonna by hard but the more you do it you can see it's not dat hard so don't quit please take my word for it 👌
3,Custom area ... won't let me change anything. I want to do 40 hours
3,Nice app
3,"ok,"
3,"ok,"
4,"Log daily since 12-4-20. Features useful, but I does find it to be a very intuitive design. Not always obvious what is where, or that additional subscreens even exist - have to try tapping everything that could be a ""button"". Major glitch - every time I record a fasting start or stop time, click 'DONE' and verify that the info appears everywhere it should be, then close the app - when reopened, the last time recorded will be gone. I've had a completed fast disappear altogether.2-22 Improved-4☆!"
4,"This app is really good , I have been fasting for just a week and I can already see and feel a difference, it reminds me to stay hydrated and tracks my progress along the way, all while further educating me on both physical and mental well being. I find that it has helped me to lower my calorie consumption and I do feel alot lighter tbh. 10/10 recommend 😝💅"
4,"Bang for the buck! App is really good. Though, meal planning menu is limited,still better than most IF tracking app in play store. Provides different IF plans depending on your comfort. Tracks water intake, weight tracking, and infos on IF planning. Giving 4 stars coz of the VERY limited menu. Hope they add more."
4,"I haven't experienced the final results of this yet but I am currently getting the results.I believe that someone who does this really correctly can get rid of obesity very easily. Another special thing about this is the look of it. It's very interesting.When you look at it, anyone wants to do it.This is a really good design. We can learn a lot more from this.Especially the scientific facts and why we should do this. This will be very successful if you add sleeping pattern and exercise pattern."
4,"This app is really helpful,motivational and easy to use 😊 Just one thing i recommend is to make it possible to switch back and forth between the previos days instead of having to go back and look for the next days date ,this way i can read the notes i left easily (hope you understood what i mean 😆), Other than that its an amazing app ,I highly recommend it 😀 Thank you so much for making this app ❤"
4,Easy to navigate and straight forward app. I'd like to try the membership program but not sure if I want to invest in that just yet. Some content is locked without the membership.
4,"Have been using this app since 9 Feb 2020. I used to eat from boredom or just because working from home made it possible. The 1st week using 14/10 was really hard, but got thru it. The 2nd wk was easier an a few days i got to 20hrs cos i was busy so i switched up to 18/6 on the 3rd wk, was so easy. Currently 8mths later, i have energy to burn, i dont 'diet' i eat what i want, including cream buns. Ive lost 14kg an started building muscle again, if only it removed chronic pain! *App has a issue*"
4,"although the app itself is amazing, no ads and theres some premium features ofcourse. but it will not help u with any sort of weightloss. ive been on a diet of 1200 calories or less for months now with 16:8 fast and ive lost no weight, infact, ive remained my exact weight and sometimes im even heavier than before. it isnt smt to do when av.weight, mainly useful for overweight ppl or people who are looking for other benefits."
4,"It's an incredible helpful app, but such a shame that the notifications/reminders does work. The notification bar just disappears after a few hours of using the app."
4,"after using this app for weeks and eating only 3 meals a day plus my dessert after dinner with a snack allowed between each meal, and also working out throughout the week lightly, i lost 14 pounds. im really happy with my results and this is only using the 14-10 and 16-8 fasting times."
4,Great app to keep my going! I keep fasting and it is fun to track my time because when I finish I get a big celebration ☺️! The only problem is that you have to pay for some big fasts so I fast out of the app I pause tej fast for a few hours but I am actually still fasting!
4,Actually a good fasting app. Only problem is I can't go premium because it says I haven't got Google play even though I downloaded the app from Google play. Edit its working now.
4,"Great clean app, does what is expected. Subscribed, but wished I noticed the widget only have water intake? Would be great to have a fast timer widget to quickly glance at."
4,"Great App., with lots of visual appeal, but also armed with ultra aggressive marketing elements that can be obstructive, attimes."
4,Very nice dashboard and helpful so far. Swhitchrd to premium to see what more i can get from the app
4,I does know if I paid I never used the app before and when I saw the premium page j unistaled the app so if I paid can j have my money back ty
4,Easy app to use just a shame there's no way to change water measurements from floz to ml.
4,I love this app then now i wanted to gain weight but i dont like the others so can you make a gaining app just like this
4,"Love this app.. lose my weight about 5 kg per month but when i start to uninstall, 1 gain weight again🤣"
4,Nice app wish it included 36 and 48 to 72 hours
4,Easy app to use just a shame there's no way to change water measurements from floz to ml.
4,Im still learning but its a great interface
4,"Ive only just installed this app, but i like it already. Q: Can i choose the day of the fast myself when im on a plan?"
4,This app is very useful and easy to use
4,"Very detailed ,,,love it"
4,Nice😛😛😛👍👍👍
4,Add landscape!!!
4,Wishlist
5,I really love this app. The fasting plans are good and can be adapted to a person's eating schedule. And all the essential information provided in the app really helps in staying informed and safe.
5,It is quite helpful.It guides me accordingly. However I am in Zimbabwe and failing to make a payment. Is there any other payment I can use. Like western union or world remit.
5,"Nice app, I would like it to be free as they do run adds. like the simple design. if it was like a one off payment of £5 I'd probably pay for it."
5,It works pretty well and keep u updated and also encouraged you to push yourself harder
5,Very good. I can find no issues with this app. I does feel hungry in fact for this past week I want to continue with this every now and then fast. Thanks for including my thoughts.
5,I love the app. I just need to remember to turn on notifications.
5,I like the access to different articles for fasting on the app.
5,Great app tracks fasting hours gives great tips and telling what state your bodys in are only some of the features 😃😃😃
5,Good app as it shows how im doing and what stage I'm at. Thumbs up!
5,It really works for me... I have reduced 1.5kg in a week's time without tired or exercise 💝 I haven't purchased the app since i want to give a try...but will purchase soon
5,It's a helpful tool to track your intermittent fasting I highly recommend it I'm using it since 2018 🙏🏻
5,This app makes it super easy to do intermittent fasting and tells you what stages of your fast you're in at all times. The free version is awesome. There are only occasional ads. Super satisfied with this app. Fantastic!
5,"Little to no ads, it's not shoved down your throat. It's a very simple app with fun facts about where you are in your fasting progress. I love the simple layout of this app, too. It's very nice for anyone already doing intermittent fasting or is just starting!"
5,Great app...it keeps track of how long you've been fasting so you does have too and you can create your own fast! Also love that it tells you what mode your body goes into the longer you fast! Great tips to keep you motivated too and also a water tracker!
5,"Great app! It tracks your weight loss, reminds you when you have fasted for too long, and it is overall just very good! If you are struggling with your weight, definitely download this!"
5,The best fasting app I have ever used. Easy and very informative.
5,Best app for weight loss
5,"This is the best app I've found to record flexible fasts. You can choose your start time, duration and end time. Very easy to use. You can also record other information like water intake and weight if you want to."
5,Very easy to use. The free trial has been more than enough.
5,"Really good and easy to use, it's helping me understand fasting better and what it does to my body. I've been feeling more energetic and less bloated since I started. Now I get to fast for 20 hours without even flinching. Update: 6 weeks and lost 10 lbs (nearly 5kg)"
5,"VERY HELPFUL! It keeps track of fasting/eating time for you, provides helpful information about what is happening to your body while fasting, reminds you to drink water, and just makes things easier! Very happy I found this!"
5,"Great app, so easy to use. Love how you get the badges to show your achievements 😁. So good how you can track your weight, measurements and water intake as well."
5,"Love this app. Day 1 was easy doing a 18:6 fast. App tracks u fasting time, great tips for encouragement, easy to set your start weight etc. Tells you when you go into ketosis (body use the fat reserves) friendly to use. Awesome."
5,"I love that it keeps me mindful of my fasting and helps me not to be Anxious about completing a fast. I love how it walks you through every stage, which is what helped encourage me to be more aggressive with my fasting."
5,This is the best app to lose weight. I can't believe that in just one week I lost 2 KG. It also encouraged me to drink more water because in the fasting period you can only drink water or herbal tea. This app deserves more than 5 stars. ⭐⭐⭐⭐⭐⭐⭐⭐⭐⭐⭐
5,Immediately impressed! I could quickly input my data and it is so full of custom parts that it works well. Deleted my other app and paid the yearly for this one.
5,"Great app, lots of features in Free version. Reminders to Drink water. Shows time to eat, Time to Fast, how much time is left in each etc."
5,"It's amazing and very organized, it would be better if we could track what we eat outside of fasting too but it's great just the way it is also."
5,"I never thought I would write a review on Google playstore, but I really wanted to write a review about this app because it's that good. This app is really nice, everything is well defined and well specified. I saw a difference only in 2 days. I am fully satisfied🌟"
5,Makes keeping track of fasting do easy!
