Rating,Comments
3,"Love this app overall, but I feel it can use some improvments like account syncing. I would love if the app synced across all my devices so I can keep track of my status."
5,I believe its a good app i will get it on my phone but im giving it a 5 star bc i trust this app also the revs are kinda good but i will get it on my phone tmmrw i rlly hope i become healthy when i go on it!
5,"i really like it! ive just started, but it helped alot on my 26 hour fast."
5,Great and very useful!! I Love that it gives yu the option to cutomize your Fasting hours
5,it is a really helpful app and keeps you motivated throughout the process.
3,Starting in times keep changing and Icon for app disappears after one day
5,Great app to keep track of intermittent fasting
5,i was wondering how long i fast each day and now i know
5,This app is great. Now I can learn how to eat less lol.
1,it was good at first but then after a few mins it wass telling me thet i overlapsed and that the thime was gone it dosent gie you the proper time anyway
5,"i love the app,just i was tempted,but i made it through 16 hours of fasting,im86 lbs wishing to be 70"
5,REally easy and fun too use
5,Amazing! Best Fasting App Ever!
5,This worked super good I reached my goal I recommend this to all my friends
5,"my fav so far, i love how it tells you which phase of fasting you're in"
5,it was very nice but i was hungry
5,great app for learning
5,It's a good app and I love it
5,It tells me to drink water because never drink water
1,before it was compatibe for my laptop now it isnt
5,im only doing the app for religous purposes
5,it helps i have a sixpack now
5,they understand me and i dont feel like im geting juged
5,i like it
5,pretty good
5,good
5,better
5,very helpful
5,Great app!!
5,AMAZING
5,good app
1,"Actual fasting history is buried in a sub menu (under the Menu > ""Me"" > ""Timeline"") when it's the main thing I want. UI is messy with pictures of people and random links on top of the basic fasting tracker interface."
1,Do not pay for this app. It's terrible. When I signed up I must've missed the fine print after the you can cancel anytime! line that said I won't receive a refund. That's terrible. It's been a few days. I've never had an app that didn't give a refund.
1,"End fasting doesn't always work. annoying. I press end fast and confirm Yes. When I come back after eating window, the app is still in fasting and asks me if I want to end fast. Tracking fasting and eating are the only features I need This app is failing with those tasks."
1,"Has been fine for a while, but now you have to watch a 20 or 30 second ad every time you open the app. I'm typically only in there for a few seconds to update my timer. Not worth my time. Deleting and finding something else."
1,"I am being charged a subscription fee for this app. Not only have I not subscribed or consented to this subscription, I didn't even know there was/is a subscription option! And I don't see anywhere in the settings to cancel or even view the subscription."
1,"I'm fine with ads, but you ap developers need to regulate how ads function. Fullscreen ads with no way of getting out of them or making it extremely difficult to close leading to accidentally opening a website screams scam."
1,Too many ads that you can't skip (I mean minutes long) to even open the app. Looking for another app.
1,Be sure to cancel well in advance if you don't want to renew! I canceled my subscription a week prior to renewal and was still charged for another year!
1,Too many ads. Makes you sit through a 1 min ad every time you open the app. Ridiculous.
1,"BEWARE: The dev does not give notice if you are subscribed and charges you, you will only find out after looking at your bank. no email saying this is about to be charged. no invoices, no communication. It is impossible to get a refund. DO NOT paid TRIAL OR SUB, maybe don' t even download. Don't bother with subscription. I was hoping for meal plans but only a hand full of recipes(no planning day by day), the extra information is not worth a sub that and more can be found on YT."
1,"Don't mind some adds but this is rediculous, makes the app almost unusable and would not consider purchase if this is how they operate. Update: Uninstalled, a short add or 2 is fine, they run 30 second plus adds. Makes app unusable. Avoid this and try something else."
1,"Ads are too frequent and too long. The photo ads that appear each time you open the app are acceptable, but those video ads where you have to wait five seconds to close them are a true test of patience."
1,can't get in too many ads that won't go away and if I close the app and open again.... another ad pops up
1,"Re: in-ter-mit-tent, adj., occurring at irregular intervals; not continuous or steady."
1,Add pop out every time I open it and try to log. Waiting time to close the app is even longer than the time I log my data. I ended up spending lots of time waiting to close the ads every day. It's very time consuming and annoying.
1,Incredibly long to boot up and lots of long ads just to pull up fasting timer.
1,"Using it for 55 days ,off last week it started paidzing, I uninstalled and reinstalled it lost all data despite it syncing,shows no badges, no awards this is frustrating."
1,"If you want a simple way to track a fasting option, this one will nickel and dime you. Tracking 1 meal a day fasting is a paid option, which is absurd."
1,"Nah fam. With the newest update, I can't set my own eating period unless I go paid. Rather, you purposefully made it more cumbersome to do so as I would need to change it every day? 5 star to 1 star, just like that. I'm uninstalling and finding a better app."
1,"It's ok to have ads, it's not ok to have LONG ads. More than 30 sec ad just to click a button? What happened to this app...."
1,"WAY too long to open due to having to watch ads 1st....had it for a long time, switching to something else."
1,"Even though I bought no ads months ago, they have put ads in every part of this app. It's complete trash now and unusable."
1,I just paid for premium and still get ads and asking to sign up from premium. I am about to reverse some charges on a card.
1,It used to be good now its not informative and full of ads.
1,"The ads contains sexual content, I wrote multiple feedbacks no solution. Uninstalling"
1,Very poor service you guys keep on debiting from my card and that should stop I've cancelled my subscription but still yet debit from my card
1,"not user friendly, only want your money. Can't setup a lasting, custom fasting period. Deletes all your data after you are done. Terrible."
1,Y the hell so much ads these days.. I have used this app before a year.. and I'm trying to follow IF again.. I'm trying to check State for motivation.. stupid ads are there how many ever time I refresh.. need help or I'm uninstalling ur app
1,App doesn't always log starts or finished fasts. Gets annoying as it's now 90% of the time.
1,"The ads recently have gotten much longer when you open the paid app. I like the app, I don't mind watching an ad for the paid version, but the ads are approaching 30 seconds just for me to start the timer. I deleted it and will find another."
1,Too much advertising. Not usable.
1,"My data is all gone when I reinstalled the app in another phone,8 months data completely gone, so disappointing!!"
1,Is anyone having trouble setting the fasting beginning to the end? When i do it manually it never allows my plan accurate.
1,"They have the worst photo shopped before and after I have ever seen 😂 and it'll say the guy lost 4 lbs and it looks like a 30 lb difference, I don't trust the 4.9 rating now I think they paid."
1,Very annoying ads every time you open the app that lasts for a while !!
1,"It was by far the best app for IF but now they show you an ad the moment you open the app. Of course if you don't pay the premium, you get adds but they used to be just adds, now they are annoying and stopping you from getting the info you want to check."
1,Used to love this practical app! And then... They gave into the advertising sirens with those lengthy Royal frigging Match ads. I usually use the app 30 sec at a time to keep track so having to watch almost a min of ad is counterproductive. Uninstalling
1,if you ever want to close your account it very difficult to close your account. In Google it will only allow you to pause the account. be aware
1,"Loved this, but now, 6 ads back to back, and I still can't get it open to log. C'mon It opened after 7 ads."
1,uninstalled. the ads became very annoying unlike before it was bearable and quick.
1,"Th y did not interact with me. But quietly took my money behind the scenes. I have no order. I downloaded the ""paid"" app"
1,Used to be very good before introducing overly invasive and unreasonably frequent advertisements.
1,"Everytime I jumped to a different screen, an ad popped up. This was irritating and difficult to negotiate thru the app. I understand that this is a way for revenue but I spent more time closing windows than on the app. Sheesh. Going back to Fastic."
1,"So far so good. I like the app, not so crazy about the ads. **UPDATE- Had to delete app, I can't sit through a 30 sec ad to just log in, that's bananas. Who wants to watch an ad before they can even get onto app to log info 🤦‍♀️"
1,Pretty basic app unless you want to pay $$$ and of course theres ads which are annoying. We always love having a skip the dish ad pop up in the last couple of hours of fasting. Not.
1,"Nice app in terms of the information it provides however, the paid version is full of unskippable ads every time you switch screens. Had to uninstall as I'm not interested in paying for a subscription service to remove the ads. Wish they offered a regular purchase option."
1,"This app is completely unusable if you don't pay. The advertising is extremely intrusive, you can't close out of it, the ads cover the whole screen and won't let you close you of them for a good bit. It's much too annoying, I'm giving up after a day."
1,I tried turning on the notification and the phone non stop vibrating. Overall the app is easy to use! I tried to uninstall and install back the app. All my data lost! My trackings for a month lost! I paid the premium and i have to start over again
1,Not usable on Pixel 6. It is not possible to skip or close any of the ads. Even when they've played the close button does not work. I have to close the whole app and reopen it every time an ad is played.
1,This is really freaking hard to figure out how to work. I'm constantly just going around poking things stop how to stop the feeding program. I can't even change the times if it's minutes plus or minus without it starting the whole what do you want your program to be again.
1,"Takes very long to open, not usable if you just want to track your fasting. For setup, I gave my last and first meal and they gave me exactly the time between the two for fasting. Most buttons which promise info just lead to the pay version. Useless app..."
1,"I uninstalled this because of the new ""full page"" style of ads, just like the word and picture game apps, not because of the fasting content. Now the app still shows up on my update list. Hopefully it will go away. I do not appreciate having to complain."
1,"I am a paying customer, it is not worth the price. That being said, a paid use would not have any issues with the app. I tried custom plans, twice, and each time my progress was removed at the end of the week, I contacted support but no response. Get another app."
1,I have recently done a paidbsubscription to Fasting Tracker app. It's been a while since I am trying to get in touch with the team. Have sent several feedback through emails but no one seem to bother. I need to cancel my subscription Can someone please revert asap
1,"30 unskippable ads... This app was always my go-to fasting tracker but now I realized I need to find a new one. Half of the features are premium only, and now we get inconvenient 30 second unskippable ads on top of that! Way to go 👏👏"
1,Trying to get in touch with someone several times but it doesn't work I get a fail message. I am struggling with the fasting timing can't change the clock to the time i started. And i paid for premium for the menus but they are not bad fot me.
1,TERRIBLE!! Worked terrible until I did a factory reset on my phone and now there is NO WAY to login into my premium account. I've also lost all of my data from my previous fasts. I'd give it ZERO stars if I could. The developers need to fix this!
1,"Ads are out of control. Everything you do, you're forced to view an ad and with countdowns to be able to skip them, no less. Ads about ""better sex"" now just earned an uninstall. There are lots of apps that do the same job but are not so obnoxious with their ads."
1,"Lost all data when my phone had to be reset. I didn't realize I had to sync after I purchased the 1 yr subscription. Very disappointing, glad I took snapshots here and there. 6 mos of hard work lost."
1,Don't try to close and update app to get features you're missing in the premium services. All data disappeared and can't seem to recover it. Waste of money at this point and first impression of the app after buying premium service for literally no gain.
1,"It kept resetting what I put in and not saving data. Also had to watch ad videos multiple times every time I opened the app or did anything on it, so annoying. Deleted almost immediately."
1,"Don't pay for this app. I thought I'd have more flexibility when I subscribed, but honestly, it's harder to adjust and less flexible than the paid version. The notifications don't work. There honestly doesn't seem to be a point to this app at all. Waste of money."
1,"I like the app a lot. I understand why there are ads with the paid version and normally that's fine with me. Hoever, when the ads run and I can't close the app or switch apps during said ad we have a problem. #uninstall"
1,Easy to use Explains benefits at exact times Gives you an easy time frame So far Love this app. Once u subscribe this app does not work at all! Only way to change anything is to delete previous info which defeats the purpose of the app. Very annoying
1,"I had a terrible review. Then they snuck in annoying ads and hopped on the subscription bandwagon. Let me make a one-time payment to get rid of the ads. If I can't do that, then you won't get my ad revenue either. I recommend everyone else do the same."
1,"This used to be a terrible app with some occasional and tolerable ads, which is fine, they need to make $$ - I get that. Lately though the ads are like these 2 minute long Gardenscapes ads that last longer than it takes me to use the app. Incredibly annoying"
1,"The app is nice, however i have an issue as i have paid for a 1year subscription and still getting adverts. This is really annoying and i feel cheated. Can this be sorted please or I get my full refund as i dont see the point of subscription. thanks"
1,Ads are a pain. I really liked this app. Then it started pushing this yahtzee ad. It wont go away till u play. Then it runs a minute ad. I gave in and tried to play to make it go away. It kept making me go to the play store to download. Super annoying.
1,"Very frustrating. I clicked on the button to end fasting but when I finish my eating period it then asks me do I want to end fast, meaning it hasn't recorded my eating period. I then had to manually input the time. Happens every day!!"
1,Poor Support. I purchased the Premuim version but cannot access the features. I ask for help but keep getting the same reply. I have stopped and restarted the app. I have uninstalled and reinstalled but all nothing. So I have for something that does not work.
1,"I am unable to change end times of fasting. Then the incessant beeping I couldn't stop. I paid for 6 months, but had to uninstall & reinstall. Then I no longer had the paid plan. It's a rip-off."
1,I purchased an annual subscription (it was on-sale) that lasted maybe 2 months. I'm owed another 10 months. There also is no customer support in the app. A feedback option isn't at all the same thing. The app itself is fine for what it is.
1,Tried this out and immediately uninstalled the app. So many ads popping up. Everytime I open the app it has a pop-up to purchase the paid content and many things were just locked behind a pay wall.
1,Why can't the sound be turned off for ads?! I've looked in settings and can't figure it out. Never had an app like this just open with sound blasting and no option to mute. Definitely not using this anymore if that's the case...
1,Poorly explained or non-existent instructions. Functionality inadequate. Pointless app. It's easier just to set alarns on your phone to remind you when to start/stop fasting.
1,It's a player of unclosable advertisements. Very frustrating when you have to force close an app due to persistent ads. The X button does not function and is for decoration only.
1,I paid for a monthly subscription and was bumped off of it after 2 weeks. The app goes back into suggesting I go premium. Google still shows that I am still subscribed. Not sure if this is an error or if this is robbery.
1,Update. It's still awful! The time edit feature is so clumsy to use and the design doesn't allow simple typed input of the time. I'm now looking for a better fasting tracker. Plenty around.
1,"Too much adds :( close button do nothing, I press it but nothing happens, so I need to close app and reopen it to be able to use. App is basically just a timer but the splash screen loading time is insainly slow."
1,"Purchase is too much money. paid version was ok at first, then ads start popping up and have to wait for ad to finsh before using app. Deleted. Using stopwatch built into smartphone. Works as well."
2,"it's glitchy after recent update. When you end your fast, you cannot adjust the time back if tou need to. It does not give you a ""today"" selection, which ruins your data and your stats. This didn't used to happen. I hope it's fixed soon or I'll have to find a different tracker app."
2,"The app looks good and works well, but the ads are too numerous and too intrusive. Especially the video ones when you open the app. They aren't skipable, and they seem to cause a delay opening the app (maybe while they load)?"
2,"The ads are way too intrusive. I don't mind ads, that's how you get paid I get it, but when I'm in a hurry and trying to open the app and an ad plays right off the bat, I'm finding another solution"
2,"So obnoxious. I just needed a simple fasting tracker (I've been intermittent fasting for years). Instead, I got a busy UI, too many popups, and annoying questionnaire filled with obnoxious messages I don't need. Two stars for not selling my data."
2,A lot of the options are locked behind a paywall. OMAD is also locked behind a Paywall. They give the option for custom but you can only set a start and have to manually stop the fast. I will be look at other options.
2,"It's a decent app if you pay for the subscription. Feels like it's made for kids, though, as every day you finish you get a million ""badges"". I just wanted a simple fasting timer."
2,"Money hungry app. Way too many ads, and takes forever to open. Note for the owners, do you really need to have ads when you have so many subscribers. Make the UI experience the best and see what will happen."
2,Way too many adds. It's a nice app but if I have to wait 40 seconds and watch an add to see where I'm at in my fast - not worth it.
2,"There are way too many ads. You can't even get into the app without having to watch a whole ad. If you somehow ignore the ads, though, it's a fair app, easy to use and understand, and the fasting achievements makes it more fun."
2,It was a terrible app up until a few days ago. Now it's nothing but a bunch of pop up advertisements. Will be deleting this app after I finish my fast. Disappointed
2,"terrible App, but enough with all the ads! After Every action is an Ad, just plain greed. Very frustrating."
2,terrible app but I'm trying to cancel my subscription and I'm still getting charged!! I can't find end subscription option in settings please help
2,"I had to delete the app. After a year or so, I had to endure far too many ads just to track my progress. By the time it loaded, I forgot what I was attempting to do! The problem worse as time went on. Now, I'm searching for a new app."
2,This don't give me any update or notifications when to start or stop eating when I close the app. Therefore it's not really useful
2,"Used to be good until now. I have to endure a full minute of advertisement to open the app. Now it is uninstalled, thank you very much."
2,"Ads are excessive, and things it advertises, like the body status are no where to be found."
2,"Had to remove a few stars. Can't get past the ad to get into the fasting app. It's in another language. I have everything set to English, not sure what's going on. Since I can't use the app, it goes from 5 stars down to 2."
2,I paid for the premium but found it difficult to keep track. Once you have a plan in place you can't flex it day to day easily so I ended up ignoring it and not keeping data. Ended up going back to the paid Fastic app where I could just push a button to start and end fasts.
2,You have to constantly reset customized plans. It's a hassle and really not worth the price.
2,It's a very basic app. I can't edit the end fast time until the day has passed and that's really annoying. My schedule moves around and I don't have an exact set time to eat. There needs to be more ability to. personally control the times on a day by day basis.
2,"Busy UI, had to hunt for the buttons. very clearly in the paid band (constant reminders), prices for the paid version are super steep. I found a more straightforward app that does the same thing for paid (or a reasonable fee to get rid of the ads)"
2,"I've used this app for years and love it, but recently, ads have been implemented, and despite uninstalling and reinstalling the app, the ads won't close. The ""x"" button doesn't work, and every time you open the app, an ad comes up. I can't even use it anymore."
2,terrible to start with. It doesn't remember every time I enter for fasting though. I have to keep screen shots of my start and stop times so I can reenter them the next day or week. It can be very frustrating!
2,"The UI is well laid out and slick. However, i think the app does just too little to justify paid subscription. There are just a few recipies included. Basically it just tracks the times when you start/stop eating. Does not track food/nutrient intake."
2,Installed app and loved it but recently it started to lock up on countdown for feeding and fasting windows. Also gave me awards for fasting for 100 weeks but I have only been using the app for over 2 weeks. I have just reinstalled the app and may update my review.
2,App is terrible but I synced my data when I switched phones and none of my badges or accomplishments transferred over. I've tried contacting the app through 4 emails now with no response. They need to figure out a system where at least someone will reply to you.
2,"I've already changed my subscription to premium for 1 month to try it out, yet there's no any change in the feature of fasting plans. I was hoping to be able to access the autophagy plans instead of the old ""custom"" feature."
2,It kept losing my fasting times that I entered. I would have to restart and what a pain that was. Really difficult to use. The timer scroll was so sensitive that it would shut if I went past the end even a slight fraction. Gave up and downloaded a different one.
2,"If I turn alert on it is constantly going off. I would really like to see my progress as I like the icon on top when in use. On custom it does not give me an end time to choose, so not very versatile. Some of the info is good."
2,"Nice idea, but doesn't function properly. Won't retain my daily data. Won't allow me to edit previous data. Doesn't seem to sync with actual date/calendar. Options for setting/editing start and end times doesn't associate yesterday/today timeline correctly."
2,"Brilliant UI. But honestly the ads are killing it. The app doesn't push through notifications so i would have to manually open it, what's more annoying is everytime i open and close it i have to watch the ads. Nice try forcing me to pay the subscription."
2,The ads made me delete. I think it's a good app but the ads have become too aggressive. I can't stand apps that show me an ad when I first open that app. There are plenty of other fasting apps that don't have such aggressive ads.
2,"Notifications don't happen, it seems pointless to have the option for an hour's notice if nothing happens - same on my partners phone. Apart from that the app's decent, but it's a pretty major component that doesn't work so I need to look elsewhere."
2,The UI is very confusing. I couldn't find how to create your own fasting plan. For example 17 - 7. Also the default notification settings are just annoying: way to many notifications that I don't care about.
2,"I like the app, but the biggest issue I have with it is that it seems to glitch and stops app notifications after a while. So it's very easy to forget to start or stop your fast, and completely forget about the app altogether, which is why I would never buy the premium version."
2,"Graphics are abismal to look at and the notification looks horrible, being just awkwardly shoved into your notification bar. Just stick with the usual notification, don't try to look so different. Other than that, it's fine. Tracks time and stuff. Idk"
2,"I like the functionality of this app however I paid for the premium version for a year, and I only received premium for about a month before it went back to ads. I don't seem to be able to reach anybody at the company to fix this issue!!"
